title,date_published,content,baseline_sentiment,vader_sentiment,most_common_words
China Prepares To Release Oil From Strategic Reserve,2021-11-18T09:00:00-06:00,"China is preparing to release crude oil from its strategic reserve, Reuters has reported, citing the country's National Food and Strategic Reserves Administration.  The news comes on the heels of reports that President Biden has asked China and other large consumers to do just that in an attempt to arrest the climb of oil prices.  However, Reuters notes that the Chinese National Food and Strategic Reserves Administration declined to comment on these reports, suggesting the move may have been planned before President Xi Jinping's virtual meeting with Joe Biden, which is when Biden first raised the issue.  We are carrying out the work of releasing crude oil reserves. And for any details related to the releasing, we will put out a statement on our website, a spokeswoman for the NFSRA told Reuters.  We will release more details on the volume of oil and date of its sale on our website in due time, just like we did in the first public auction,nbspthe spokeswoman told Bloomberg.  Earlier this week, Reuters reported, citing unnamed sources, that besides China, the Biden administration had also approached Japan, India, and South Korea with the suggestion they release crude oil from their strategic reserves.  The oil auction announced by the National Food and Strategic Reserves Administration would be the second one in September, the authorities auctioned 7.4 million barrels of crude for sale. The news did weigh on oil prices but only for a short while before prices rebounded again.  Then, earlier this month, Beijing also ordered the release of gasoline and diesel as the prices of fuels in some parts of China were rising too fast.  China has its own plan for the strategic petroleum reserve SPR releases. We expect the second release volume should be similar to the first one,nbspSIA Energy analyst Sengyick Tee told Reuters.  By Irina Slav for Oilprice.com",-1,-0.6908,"[' ', 'oil', 'China', 'release', 'Reuters', 'crude', 'Biden', 'prices', 'strategic', 'National', 'Food']"
Chevron's Latest Oil Deal With Iraq Is One To Watch,2021-11-17T17:00:00-06:00,"The newly resuscitated Iraq National Oil Company INOC has been authorised by the government in Baghdad to directly negotiate with U.S. oil giant, Chevron, for it to develop the long-delayed Nasiriyah oil field in the southern DhiQar province, according to several domestic news sources.nbsp  The idea of developing the 4.36 billion-barrel Nasiriyah oilfield has been mooted by a rapid succession of governments in Iraq since it was discovered by INOC in 1975. The original plan to develop the field on a standalone basis was shelved in the lead-up to the Iran-Iraq war that began in 1980 and lasted until 1988. The field eventually came on-stream in 2009 and was listed on the 2009-2010 fast-track development plan, which aimed to raise its output to at least 50,000 bpd in the first phase.nbsp  In the first half of 2009, Chevron was one of four international oil companies IOCs, along with Italyrsquos ENI, Japanrsquos Nippon Oil, and Spainrsquos Repsol, to be invited to submit bids to develop the field on an engineering procurement construction EPC contract basis. The Japanese consortium led by Nippon Oil, and comprising Inpex, and JGC Corporation, then looked set to win the contract before negotiations broke down again.nbsp  In 2014, a serious push was made to resuscitate the development of the Nasiriyah field within the broader scope of the lsquoNasiriyah Integrated Projectrsquo NIP that also included the development of adjunct lesser oil sites to the main Nassiriyah site and the construction of a 300,000 barrels per day bpd refinery. Bids for this wider project were encouraged by the government-ordered changes to the original Iraq technical service contract TSC that were aimed at addressing the concern of many IOCs that saw the contract model as falling short of the production sharing contracts model that they preferred.nbsp    Unlike the previous contracts, the new TSC variant offered investors a share in project revenues, but only when production began, and the Oil Ministry would pay recovery costs from the date of commencement of work. This differed from the previous contract where the costs were only paid when the contractor raised production by 10 per cent. This said, investors would still have to pay 35 per cent taxes on the profit they made from the Nassiriya project, the same amount as in previous deals.nbsp  At that point in 2014, the international engineering and construction firm Foster Wheeler had already completed a front end engineering and design study for the refinery, and 12 potential bidders were on the list. These comprised Indiarsquos Reliance Industries, Oil and Natural Gas Corp, and Essar Oil, Russiarsquos Rosneft, Lukoil, and Zarubezhneft, Francersquos Total, and Maurel amp Prom, Chinarsquos CNPC, the U.S.rsquos Brown Energy, a Japanese joint bidding team from JGC and Tonen General, and South Korearsquos GS Engineering amp Construction.nbsp  Given longstanding IOC concerns about legal, accounting, and financial transparency in Iraq, this 2014 initiative to develop the Nassiriyah oil field foundered. As summarised by the independent international non-governmental organisation, Transparency International TI, in its lsquoCorruption Perceptions Indexrsquo, Iraq demonstrates ldquoMassive embezzlement,nbspprocurement scams, money laundering, oil smugglingnbspand widespread bureaucratic bribery that have led thenbspcountry to the bottom of international corruptionnbsprankings, fuelled political violence and hamperednbspeffective state building and service delivery.rdquonbsp  In 2017, China relaxed its directive of the previous two years to all state-owned hydrocarbons companies to cut budgets. From the Iraqi side, this coincided with a fresh impetus for expediting as much production from the south of the country ahead of the chaos in oil supplies from the north that was likely to result and did from Kurdistanrsquos independence referendum to be held in September.nbsp  These factors then led to Chinarsquos Sinopec and PetroChina proposing a deal that would see the NIP being rolled out as part of the broader lsquoIntegrated South Projectrsquo ISP. The ISP later rebranded as the lsquoSouth Iraq Integrated Projectrsquo aimed to boost output across Iraqrsquos southern oilfields, and also to build out related infrastructure, including pipelines, transport routes, and the construction of the Common Seawater Supply Project CSSP.nbsp  ldquoThe Chinese said that they would spend US$9 billion on the [NIP-related] refinery and the first phase of developing Nassiryah but as, under the terms of Iraqi oil contracts, the Iraqis would have to pay back this cost to the Chinese from the value of oil recovered,rdquo a source who works closely with Iraqrsquos Oil Ministry told OilPrice.com. ldquoThe initial reaction from the Oil Ministry was to decline the offer, and to say that the development should only cost around US$4 billion, which the Chinese in turn flatly turned down.rdquonbsp  The Chinese had other demands that grated on Iraq at that time as well. ldquoChina also wanted its firms to receive their costs back in a much shorter timeframe than most other similar projects,rdquo said the source. ldquoThis meant that they were effectively asking for a per barrel remuneration fee at a 15 per cent premium to the highest maximum fee being paid to any company in Iraq for a regular crude oil producing field, which was US$6 per barrel to PetroChina for al-Ahdab,rdquo he added. ldquoThis would mean that the Chinese would get around US$6.90 per barrel, more than [Angolarsquos] Sonangol for its heavy oil extraction at Najmah [US$6 per barrel] and Qairayah [US$5 per barrel] and would dwarf the US$1.49 per barrel that [Malaysiarsquos] Petronas was getting for the same type of field of Gharraf,rdquo he told OilPrice.com. ldquoChina also demanded that it was given [Iraq] dinar-denominated government-backed bonds for the entire amount [US$9 billion] that could be cashed in if the development did not start to generate large amounts of oil quickly,rdquo he underlined.  Given the negative history of dealing with China over the Nassiriyah project and the fact that Russia is occupied elsewhere in the country and the region, the U.S. might be in an unusually positive position to take a significant role in either the Nassiryah field development alone or in the broader NIP. This has been bolstered by the apparent willingness of Iraqrsquos de facto leader - radical Shiite cleric Moqtada al-Sadr ndash to engage with U.S. ally, Saudi Arabia, and by the shift in tone from one key player in Iraqrsquos influential al-Hakim family.nbsp  Whether this shift in attitude towards doing substantial and enduring business with the U.S. across its oil, gas, and petrochemicals sectors is genuine, or whether it is just the usual games-playing by Baghdad to keep the money flowing from Washington, remains to be seen but the slew of deals signaled recently appear propitious at this stage.nbsp  By Simon Watkins for Oilprice.com",1,0.9324,"['oil', ' ', 'Iraq', 'field', 'Oil', 'US$', 'barrel', 'development', 'contract', 'Chinese', 'rdquo']"
Breakeven Price For New Oil Projects Drops In 2021,2021-11-17T12:00:00-06:00,"Rystad Energyrsquos annual cost of supply analysis has revealed that costs within the upstream sector have come down considerablynbspin 2021, making new oil more competitive and significantly cheaper to produce. The average breakeven price for new oil projects has dropped to around $47 per barrel ndash down around 8% over the past year and 40% since 2014, with offshore deepwater remaining one of the least expensive sources of new supply.  Our cost of supply curve for liquids indicates that back in 2014, an oil price of close to $100 per barrel was required to produce 100 million barrels per day bpd in 2030. By 2018, the required oil price was closer to $55 per barrel, and in 2020, it dropped to $45 per barrel. Our latest estimate remains unchanged this year at $45 per barrel for 100 million bpd of production in 2030.  We maintain the required oil price to produce 100 million bpd in 2030 unchanged, despite the declining average breakeven price of new oil projects, because the potential supply for 2030 has decreased since last year due to delays in sanctioning activity and conservative shale producers.  In 2014, we estimated that the total 2030 liquid potential was 104 million bpd, while in 2018, this jumped considerably to 135 million bpd mainly driven by increased potential volumes from North American tight oil. However, low activity levels in 2020 and 2021, due to the Covid-19 pandemic and a general focus on the energy transition, led to a downward adjustment in the overall liquid potential. In 2020, the potential 2030 supply was revised down to about 116 million bpd, and in 2021 we revised it further to about 113 million bpd.  ldquoAs the theoretical supply in 2030 exceeds the demand trajectory by more than 10 million bpd, climate policies should be more demand-focused rather than supply-focused. Supply cuts enacted within one country will largely be countered by supply increases from other countries, while demand cuts are not met with new sources of demand,rdquo says Espen Erlingsen, head of upstream research at Rystad Energy.    Breakeven prices by production source  From 2014 to 2018, tight oil and OPEC were the clear winners as both segments saw a reduction in the breakeven price and an increase in potential volumes. Back in 2014, Rystad Energy estimated the average breakeven price for tight oil to be $82 per barrel and the potential supply in 2025 to be 12 million bpd. Since then, the breakeven price has come down while the potential supply has increased. In 2018, we estimated an average breakeven price for tight oil of $47 per barrel and potential supply of 22 million bpd. The breakeven price for tight oil has continued to fall, reaching a current average of $37 per barrel. However, tight oil production potential in 2025 has dropped from our 2018 estimate to around 16 million bpd currently. This drop is due to the sharp reduction in activity during 2020. Lower activity last year, and a modest recovery this year removed potential tight oil supply from the market.    Between 2014 and 2018, offshore shelf and deepwater experienced a cost reduction of around 30%. However, the lack of new sanctioning activity over the period reduced the potential 2025 offshore liquid supply. Meanwhile, since 2018, breakeven prices for offshore deepwater fell by 30%, and for shallow water by 17%. These cost reductions put average breakeven prices for deepwater just below tight oil. At the same time, the potential 2025 offshore liquids supply has not changed much. This means offshore has had the most attractive development over the last three years.  Another segment with a positive development is oil sands. From 2014 to date, the average Brent breakeven price for new oil sands projects has declined from around $100 per barrel to around $55 per barrel. The main reason is that many future phases will be developed as smaller, incremental brownfield expansions rather than large-scale greenfield projects. In several cases, operators have not only indicated smaller expansions, but also plans to achieve cost savings by tying these into existing central processing facilities CPFs rather than building new CPFs ndash which might have happened several years ago when the pace of development was much quicker.  Onshore Middle East is the cheapest source of new production with an average breakeven price of around $32 per barrel. This is also the segment with one of the largest resource potentials. Offshore deepwater is the second cheapest source of new production, with an average breakeven price of $36 per barrel. Shelf remains the segment with the largest resource potential at 126 billion barrels of unsanctioned volumes. Russia onshore continues to be one of the more expensive resources due to the high gross taxes in the country.  By Rystad Energy",1,0.5934,"['oil', 'supply', 'potential', 'price', 'breakeven', '$', 'barrel', 'million', 'bpd', 'new', 'average']"
Oil Inches Higher After EIA Reports Surprise Crude Draw,2021-11-17T09:40:00-06:00,"Crude oil prices gained today after the Energy Information Administration reported a crude oil inventory draw of 2.1 million barrels for the week to November 12.  At 433 million barrels, the authority said, crude oil inventories were 7 percent below the five-year average for this time of year.  The reported draw compared with an unexpected build of 1 million barrels for the previous week and analyst expectations of another build, of 1.55 million barrels.  In gasoline, the EIA reported an inventory decline of 700,000 barrels for the reporting period, which compared with a draw of 1.6 million barrels for the previous week.  Gasoline production averaged 9.9 million bpd last week, which compared with 10.1 million bpd for the prior week.  In middle distillates, the EIA estimated an inventory draw of 800,000 barrels for the seven days to November 12, with production averaging 4.8 million bpd.  This compared with a stock draw of 2.6 million barrels for the previous week and average daily production of 4.9 million barrels.  Refineries processed 15.4 million bpd last week and imports of crude stood at 6.2 million bpd. This compared to refinery runs of 15.4 million bpd and imports of 6.1 million bpd for the previous week.  Oil prices were trending lower at the time of writing, with Brent crude at $81.79 a barrel and West Texas Intermediate at $79.87 a barrel.  A forecast by the International Energy Agency that high oil prices would lead to a boost in production served to limit the upward potential of prices this week, even though concern about the adequacy of global supply remained.  At the same time, the IEA revised up its forecast for the average price of Brent for next year because of the supply concerns. Now, the authority expects the benchmark to average $79.40 per barrel in 2022.  By Irina Slav for Oilprice.com",-1,-0.9118,"['million', ' ', 'barrels', 'week', 'bpd', 'draw', 'compared', 'oil', 'prices', 'crude', 'average']"
U.S. Asks China To Release More Oil From Its Reserves,2021-11-17T09:00:00-06:00,"President Joe Biden has asked his Chinese counterpart Xi Jinping to release more crude oil from its reserves in concert with the U.S., in a bid to stabilize international oil prices.  Thatrsquos according to a South China Morning Post report citing an unnamed source familiar with the topics that Biden and Xi discussed during a virtual meeting this week.  China released gasoline and diesel from its reserves earlier this month to halt a price rise in some parts of the country that was beginning to make people nervous. Two months earlier, Beijing held its first-ever crude oil auction, at which it offered 7.4 million barrels of crude from the strategic national reserve. The news of the auction pushed prices lower, but the effect did not last.  In the United States, members of the Biden administration have mentioned the release of oil from the petroleum reserve as one possible move to arrest the climb of fuel prices. Democratic legislators have called for this, although experts warn that it will not have the desired effect.  ldquoOne of the pressing issues for both sides is energy supply,rdquonbspsaid the South China Morning Post source. ldquoCurrently, the energy departments from both sides are negotiating the details.rdquo  China, according to the source, is open to a concerted release of crude oil from the two national reserves but has not yet made a specific commitment, noting that it needed to first take care of local consumption needs.  The proposal appears to be yet another tool in President Bidenrsquos box for handling gas price troublemdasha box that has been often referred to by his administration but rarely in any detail. One other suggestion that a group of Democratic senators made earlier this month was to ban crude oil exports so there is more crude for the domestic market.  The idea did not win support from the oil industry.  By Irina Slav for Oilprice.com",-1,-0.98,"[' ', 'oil', 'crude', 'China', 'Biden', 'release', 'reserves', 'prices', 'source', 'earlier', 'President']"
