title,date_published,content,baseline_sentiment,vader_sentiment,most_common_words
Biden Announces 50 Million Barrels SPR Release To Lower Oil Prices,2021-11-23T07:45:00-06:00,"US President Joe Biden announced on Tuesday that the Department of Energy would release 50 million barrels of oil from the Strategic Petroleum Reserve SPR in a bid to lower high gasoline prices in a coordinated effort with other major oil-consuming nations.  The U.S. Department of Energy will make available releases of 50 million barrels from the SPR, of which 32 million barrels will be in the form of an exchange over the next several months, releasing oil that must be returned to the Strategic Petroleum Reserve in the years ahead. Another 18 million barrels will be an acceleration into the next several months of a sale of oil that Congress had previously authorized, the White House said on Tuesday.  The SPR release from the United States is being carried out in parallel with other major energy-consuming nations, including China, India, Japan, the Republic of Korea, and the United Kingdom.  ldquoThe President stands ready to take additional action, if needed, and is prepared to use his full authorities working in coordination with the rest of the world to maintain adequate supply as we exit the pandemic,rdquo the White House said.  ldquoAmerican consumers are feeling the impact of elevated gas prices at the pump and in their home heating bills, and American businesses are, too, because oil supply has not kept up with demand as the global economy emerges from the pandemic,rdquo the U.S. Administration said.  Other major consumersmdashincluding India, China, and Japanmdashhave already signaled they would also release crude from their reserves.  Yet, analysts expect the coordinated move to have only a temporary effect on international crude oil prices and say the market has likely already priced in the SPR releases.  At the same time, the OPEC group warned on Monday that it could respond to a coordinated release by potentially reconsidering plans to continue adding more production each month to meet demand.  OPEC is set to meet next week to decide the oil production policy for January. The coordinated pushback against the OPEC policies could prompt the group to lower or even pause its monthly addition of 400,000 bpd of oil production, ING strategists Warren Patterson and Wenyu Yao said on Tuesday.  ldquoThe prospect of retaliation from OPEC does leave the potential for further volatility in oil markets,rdquo they added. nbspnbspnbspnbsp  By Tsvetana Paraskova for Oilprice.com",0,0.1779,"[' ', 'oil', 'release', 'million', 'barrels', 'SPR', 'coordinated', 'said', 'OPEC', 'Tuesday', 'prices']"
U.S. Shale Is Refusing To Reinvest Despite Record High Cash Flow,2021-11-22T17:00:00-06:00,"Reinvestment rates among US shale oil producers hit an all-time low in the third quarter of 2021, resulting in a record free cash flow for the quarter, and are projected to fall even lower by year-end according to a Rystad Energy analysis. The analysis focused on a peer group of 21 public US shale oil producers, excluding majors, that together account for 40% of the expected 2021 output.  The peer grouprsquos combined reinvestment rate in the third quarter of 2021 was 46%, down from 53% over the same period in 2020 and way lower than the historical average of above 130%. The reinvestment rate is calculated by comparing shale producersrsquo oil and gas capex against their cash flow from operations CFO. The CFO of the last quarter was the strongest since the second quarter of 2019.  The analysis shows $7 billion in underspending by shale producers over the third quarter of 2021, comparing oil and gas capex with CFO. Operators managed to slightly increase peer-group quarterly capex in this yearrsquos third quarter to $5.9 billion, up from $5.3 billion in the previous quarter, while further increasing CFO to $12.8 billion. All but one operator balanced spending in the third quarter of this year, reaching a new level of industry-wide cash balancing.  ldquoSuch a low reinvestment rate stands out for shale industry observers, especially as the peer group reported a record-breaking free cash flow FCF and earnings before interest, tax, depreciation and amortization EBITDA of $6 billion and $16 billion, respectively. But itrsquos not the end of the reinvestment slide,rdquo says Alisa Lukash, vice president for North American shale at Rystad Energy.    Rystad Energy projections show that reinvestment will fall further to 40% in the fourth quarter of 2021. Also, for the first time since late 2018, the grouprsquos combined net debt dropped below the eight-year average floor of $52 billion, coming in at $51 billion for the third quarter. Additionally, leverage ratios continued their consistent decline in keeping with the past three quarters.  Third-quarter results show several large independent operators ramped up spending in line with another financially robust quarter, in part due to the strong recovery in West Texas Intermediate WTI crude prices. Operators, as expected, started to communicate 7% to 15% cost inflation, with much of the impact anticipated to come in early 2022. However, this is expected to be absorbed by improved well productivity and capital efficiencies in most cases.    Combined third-quarter net income for the peer group amounted to $5.3 billion, double the income earned in the second quarter of 2021 and significantly higher than the sizable losses of $6 billion and $2.1 billion in the third and fourth quarters of 2020, respectively. EBITDA, meanwhile, recovered to $16.3 billion in this yearrsquos third quarter, a level not seen historically. FCF across the peer group was $5.6 billion, a rise of $500 million from the previous quarter and more than double the $2.5 billion seen in last yearrsquos final quarter.  Dividend payments jumped by 70% for the peer group in this yearrsquos third quarter versus the second quarter. In comparison, the actual dividend-to-capex ratio increased to 26% compared to 17% in the preceding quarter. Further capital spending control by the industry was aimed at deleveraging and garnering stable shareholder support. Stock buybacks have predominantly been paused as the market recovered naturally with the WTI price increase. However, a few companies CLR, FANG, PDCE initiated buybacks amounting to $200 million.  For the first time since late 2018, the peer group dropped combined net debt below the eight-year average floor of $52 billion, reporting $51 billion for this yearrsquos third quarter. Many operators mentioned revised hedging plans for 2022 due to lower expected leverage. Both leverage ratios ndash total debt to assets and total debt to equity ndash have consistently declined during the last three quarters. Despite more robust stock prices driving total equity up in 2021, the decline in leverage ratios has been partly offset by consistent debt issuance flared by merger and acquisition opportunities in the shale sector.  By Rystad Energy for Oilprice.com",1,0.981,"['quarter', '$', 'billion', 'peer', 'shale', '2021', 'group', ' ', 'reinvestment', 'yearrsquos', 'debt']"
India May Join Coordinated Strategic Oil Reserves Release,2021-11-22T10:00:00-06:00,"India is ready to join the global efforts of major oil consumers led by the United States to reduce oil prices.  The world's third-largest oil importer, India, plans to release crude oil from its strategic petroleum reserves in a coordinated effort of consuming nations to bring down prices, three government sources told Reuters on Monday. nbsp  The United States has asked the top Asian consumers India, Japan, China, and South Korea to release crude from their respective strategic stockpiles after the OPEC group has been ignoring for months calls from consumersmdashmost vocal from the U.S.mdashto increase the monthly production by more than the 400,000 bpd decided in July.  At the end of last week, China was already preparing to release crude oil from its strategic reserve, Reuters reported, citing the country's National Food and Strategic Reserves Administration.  We are carrying out the work of releasing crude oil reserves. And for any details related to the releasing, we will put out a statement on our website, a spokeswoman for the Chinese administration told Reuters.  Japan is also considering a release from its crude reserves, together with the United States and other major consumers, to reduce prices, Japanese Prime Minister Fumio Kishida said on Saturday, as quoted by Kyodo News agency.  If Japan goes ahead with such a release, it would be the first time the country has tapped into its oil reserves to reduce prices. Japan has previously released crude from reserves, but only in times of supply shortages, such as during the Gulf War in 1991 or in the wake of the Fukushima disaster when it closed all its nuclear plants. Currently, Japan's Oil Stockpiling Law allows for reserve releases only in such cases, nor for lowering oil prices. Officials, however, say that stockpiles that exceed Japan's reserve targets could be released without revising the law, Kyodo News notes.  Market talk of a coordinated reserves release has dampened sentiment and dragged oil prices lower in recent days, although Goldman Sachs, for example, says that the market has already priced in such a global effort.  By Tsvetana Paraskova for Oilprice.com",-1,-0.963,"['oil', ' ', 'prices', 'release', 'crude', 'reserves', 'Japan', 'India', 'consumers', 'United', 'States']"
"Big Oil Is Finally Exercising Restraint, And Biden Is Pissed",2021-11-20T16:00:00-06:00,"This week, the Najahrsquos Desert Oasis gas station in southeastern California put up a sign of the times. It read $6.39 for regular. This remote gas pump isnrsquot your average fuelling station, to be sure, and even at the best of times, it has the highest gas prices in the country. But breaking the $6 mark is a monumental occasion, even for Najahrsquos. In California as a whole, the average gas prices are a painful and record-breaking $4.68 per gallon, and the nationwide average for a gallon of regular gasoline is now $3.41 -- a whopping $1.29 more than just a year ago. Indeed, inflation rates across the country are at a 31-year high, and Americans are really feeling the squeeze, and many are casting about who to blame for the hardship.  Although global demand for electricity has bounced back to pre-pandemic levels, global oil production has not -- not by a long shot. In the United States, oil production remains 12% lower than in February 2020, right before the impact of the pandemic ripped through oil markets. Thatrsquos the equivalent of pulling the U.S.rsquos entire production in the Gulf of Mexico out of the global economy. And oil and gas production levels have remained low even as the world suffers from an extreme energy crunch and skyrocketing fuel prices.nbsp  And whose fault is it Depending on who you ask, the answer is either Vladmir Putin and a geopolitical power play on the part of Russia, Joe Biden and his dastardly plan to do away with fossil fuels and suck U.S. coffers dry in the process, or OPEC and their stingy refusal to respond to the energy crisis unfolding in Europe, Asia, and to a lesser extent the United States. Now, President Joe Biden is pointing the finger at another culprit the conniving and greedy domestic oil and gas industry. This week the U.S. president asked federal regulators to open an investigation into the U.S. oil and gas industry to determine whether companies are engaging in illegal conduct by profiting off of consumersrsquo pain, citing mounting evidence of anti-consumer behavior by oil and gas companies.  The bottom line is this gasoline prices at the pump remain high, even though oil and gas companies' costs are declining, President Biden wrote this week in a letter to FTC chair Lina Khan. The Federal Trade Commission has authority to consider whether illegal conduct is costing families at the pump. I believe you should do so immediately.nbsp  Indeed, the price of unfinished gasoline has declined more than 5% over the last month. Typically this decline would be reflected in prices at the pump, but instead, gas station sticker shock continues to intensify across the U.S. This unexplained large gap between the price of unfinished gasoline and the average price of the pump is well-above the pre-pandemic average, Biden continued, adding that Big Oil is raking in significant profits off higher energy prices.  Backing up President Bidenrsquos claims, Bloomberg released a report this week that oil and gas explorers in the United States may point to politics as the reason that they are holding back on upping production to ease oil prices, but the real reason is much simpler they are making money hand over fist. According to figures from Deloitte LLP, U.S. oil companies are making more money now than at any other point in the entire history of the nationrsquos shale revolution. ldquoAnd this may just be the beginning,rdquo Bloomberg Markets wrote. ldquoFree cash flow, the key metric watched by investors, probably will increase by 38% next year, presuming oil prices remain elevated.rdquo  The American Petroleum Institute has fired back at President Biden in the wake of his plea to the FTC, saying that the move is merely a ldquodistraction from the fundamental shift that is taking place and the ill-advised government decisions that are exacerbating this challenging situation. A representative of API went on to criticize Bidenrsquos allocation of his time and energy to fight with the domestic oil and gas industry and OPEC, saying that his attentions would be better spent ldquoencouraging the safe and responsible development of American-made oil and natural gas.  By Haley Zaremba for Oilprice.com",-1,-0.7933,"['oil', 'gas', 'prices', ' ', '$', 'pump', 'average', 'production', 'Biden', 'U.S.', 'week']"
Biden Asks The World For Help Easing The Global Energy Crisis,2021-11-21T18:00:00-06:00,"Oil prices have dipped to their lowest levels in six weeks, with both Brent and WTI dropping below the psychologically important $80 per barrel mark for the first time in weeks. Brent was quoted at $79.67/barrel in Friday's intraday session, with WTI trading at $77.65 as talk of several countries releasing crude from their strategic reserves continued to gain momentum.  According to Reuters, the Biden administration has reached out to several countries, including China, India, South Korea, and Japan, urging them to synchronize the release of crude from their Strategic Petroleum Reserves SPRs in a bid to lower global energy prices.  On the opposite side of the spectrum, European gas prices have recovered from their intra-week lows as indications of Russian supply flows remained disappointingly low.nbsp  According to the Financial Times, whereas Gazprom OTCPKOGZPY started adding some gas to its largest storage sites in Germany and Austria last weekend, Russia has failed to book additional pipeline capacity, suggesting that any storage fill would come from existing flows.  Russia has done what it said it was going to do, but in a very narrow way. What would get a bigger reaction from the market would be if Gazprom went back to auctioning short-term gas supplies, as they have done in previous years, Laurent Ruseckas at IHS Markit tells FT.nbsp  Front-month UK National Balancing Point NBP gas rose by 1.89 pence p per therm w/w to USD 204.79p/therm on 15 November, a strong rebound from the settlement of 178.98p/therm on 10 November. Dutch Title Transfer Facility TTF gas rose by EUR 0.873 per megawatt hour MWh, before surging above EUR 89/Mwh on 16 November in the wake of the temporary suspension of the regulatory approval process for the Nordstream 2 pipeline.nbsp  Also worth noting The price of EUA carbon allowances has been bolstered by the COP26 meeting, and in particular by the completion of the Paris Agreement's carbon trading framework. The front-month EUA contract rose by EUR 5.30/t w/w to an all-time high of EUR 65.93/t on 15 November.  While gas prices remain strong in other regions, US prices have continued to fall thanks to a relatively comfortable inventory position due to a warmer-than-usual start to the winter and, of course, the latest SPR developments.nbsp  According to the American Gas Association AGA, there were 96 heating degree days in the week to 13 November, 28 fewer than normal i.e., warmer conditions than normal. The cumulative number of degree days since the start of October stands at 421, 134 fewer than normal and 27 fewer y/y.  Front-month Henry Hub gas prices declined USD 0.41 per million British thermal units mmBtu w/w to USD 5.017/mmBtu.  Coordinated SPR release  Biden's highly unusual move comes just months after he made another unusual request to OPEC to boost production so as to tame the oil price rally. Predictably, OPEC declined the offer and has stuck to its earlier routine to boost output by 400,000 bpd a month that it started in August until the rest of the 5.8 million bpd cut is phased out.  However, Biden's SPR move is a different gambit altogether because, unlike OPEC, which is clearly interested in maintaining high oil and gas prices, China and India have already begun releasing crude from their SPR's with a similar end-game to Biden's Lower oil prices.nbsp  China does not disclose the volumes of crude flowing into its strategic and commercial stockpiles. However, it's possible to work out an estimate by deducting the total amount of crude available from imports and domestic output from the amount of crude processed.  Related Brits Google lsquoEnergy Bill Helprsquo As Energy Suppliers Go BankruptCalculations based on this method reveal that China drew 589,000 bpd from its SPR in May 980,000 bpd in June, and 223,700 barrels per day in July. HFI Research estimates that China's SPR capacity sits at between 840 to 1,260 million bbl, with current reserve levels closer to the lower end of that range.  Meanwhile, crude imports for the first eight months of 2021 clocked in at 10.4 million bpd, down 5.7% from the same period last year.  Back in June, Beijing announced huge cutbacks in import quotas for the country's private oil refiners. According to Reuters, China's independent refiners were awarded a combined 35.24 million tons in crude oil import quotas in the second batch of quotas this year, a 35% reduction from 53.88 million tons for a similar tranche a year ago.  The story is pretty much the same in India.  India announced in August that its SPR will be more active, although its relatively small size compared to China's makes its impact more muted.  India has started selling oil from its SPR to state-run refiners as part of efforts to commercialize the storage. Reuters reported 5.5 million barrels are in the process of being sold, while Indian newspaper Mint reported on Sept. 12 that a total of 4.3 million barrels would be sold to two refiners by December.  These are relatively low volumes, representing little more than one's day demand for India.  Done on an independent basis, SPR releases from either the U.S., China, or India might not do much to unsettle the global oil markets. A coordinated release by 4 or 5 of the biggest SPRs is, however,nbsp a different story.  Immediate Relief  President Biden has faced calls for action from various parts of the Democratic Party,  including the Senate Majority Leader Chuck Schumer, who on 14 November demanded immediate relief at the gas pump. U.S. gas prices have surged 60% since the beginning of the year, with prices in California hitting all-time highs.  Related Our Renewable Future Will Run On CopperHowever, the key advisors in the White House currently appear to be split along the lines of their main area of expertise.  The economic and political advisors to the president who are generally in favor of early action against gasoline prices point to falling presidential approval ratings and worrying inflation readings. Energy advisors to the president who are generally more willing to wait point to the gasoline price forecasts in the Energy Information Administration's EIA's Short Term Energy Outlook the EIA expects gasoline to average USD 3.16 per gallon gal in December, down from the current national average of $3.41per gallon, and between USD 2.99-3.02/gal in each of the first six months of 2022.  According to Standard Chartered analysts, the best result for the administration would be that the market stays in the current holding pattern for an extended period. A sharp oil price rally above USD 85/bbl would likely force a release of reserves, but the more that time goes by, the more we expect fundamentals to become more comfortable, and the less credible the calls for a rapid rally well beyond USD 100/bbl are likely to become.  The analysts say that calls for a release have led to a situation whereby a significant amount of money is on the side-lines of the market looking to buy the dips after any actual release. While many traders doubt the credibility or the effectiveness of an SPR release, few would wish to be caught in an exposed long position at the time a release happened, and keeping that money out of the market has taken the momentum out of the price rally. The threat of a release has already gained the US administration at least two weeks of extra time.nbsp  Losing some credibility among oil traders by not releasing quickly seems a relatively minor cost in terms of the time gained and the underlying weakening of market fundamentals and the associated dispersal of the market-tightness fear factor.  By Alex Kimani for Oilprice.com",1,0.9875,"[' ', 'prices', 'gas', 'SPR', 'release', 'oil', 'crude', 'China', 'million', 'India', 'USD']"
EIA Sees Brent Oil Price Falling To Average $72 In 2022,2021-11-18T12:00:00-06:00,"Crude oil prices are set to decline next year from the current levels of around $80 a barrel as global inventories will start to build again with supply rising more than demand, the U.S. Energy Information Administration EIA said on Thursday.  Brent Crude prices are set to average $72 per barrel next year, due to the expected surplus on the market on the back of rising production from the United States and the OPEC group.  According to EIArsquos latest monthly Short-Term Energy Outlook STEO, global crude oil demand will exceed global supply through the end of this year, contribute to some additional inventory draws, and keep Brent Crude prices above $80 per barrel through December 2021. Global oil consumption exceeded crude oil production for five consecutive quarters, starting in the third quarter of 2020, the EIA said. Oil stocks in the OECD countries have fallen by 424 million barrels since then.  However, next year will see the beginning of stock builds, which will pressure prices downwards, the U.S. administration said.  Earlier this week, the International Energy Agency IEA said that early signs showed that OECD oil stocks had already started to build in October.  After hitting a six-year low in September, commercial oil stocks in OECD countries showed a marginal build in October, suggesting that the months of hefty inventory draws globally may be over, the IEA said on Tuesday in its closely watchednbspOil Market Reportnbspfor November.  OECD total industry stocks plunged by 51 million barrels in September, with crude oil and middle distillate accounting for most of the declines. Europe led the stock drawdowns in September when total OECD industry stocks stood at 2.762 billion barrels, which was 250 million barrels below the five-year average and the lowest level since the start of 2015, the IEA said.  However, preliminary data and satellite observations of stock changes in October point to a marginal stock build and suggest the tide might be turning, the agency said.  ldquoThe world oil market remains tight by all measures, but a reprieve from the price rally could be on the horizon,rdquo the IEA said this week.  By Tsvetana Paraskova for Oilprice.com",-1,-0.9168,"[' ', 'oil', 'said', 'year', 'stocks', 'OECD', 'prices', 'build', 'barrels', 'stock', 'IEA']"
