title,date_published,content,baseline_sentiment,vader_sentiment,most_common_words
Oil Prices Fall After EIA Reports Crude Inventory Build,2021-11-10T09:37:00-06:00,"Crude oil fell today after the Energy Information Administration reported an inventory build of 1 million barrels for the week to November 5.  This compares with a build of 3.3 million barrels for the previous week and analyst expectations of a build of 1.9 million barrels.  At 435.1 million barrels, the EIA said, crude oil inventories were 7 percent below the five-year average for this time of year.  In fuels, inventory movements included a draw in gasoline and another one in middle distillates.  In gasoline, the authority estimated inventories had shed 1.6 million barrels in the week to November 5, while in middle distillates, inventories fell by 2.6 million barrels last week.  This compared with a gasoline stock decline of 1.5 million barrels for the previous week and a middle distillate build of 2.2 million barrels.  Gasoline production last week averaged 10.1 million bpd, with middle distillate production at 4.9 million bpd.  This compared with gasoline production of 10.2 million bpd for the previous week and middle distillate production of 4.8 million bpd.  Oil prices got a boost earlier this week after the U.S. government lifted travel restrictions for visitors from abroadmdasha move seen to provide strong support to jet fuel demand, which has been lagging behind other fuels because of such restrictions.  In a further boost for prices, the EIA said in its Short-Term Energy Outlook that demand for oil and oil products was recovering much faster than supply, driving prices higher.  To address this imbalance that has pushed retail fuel prices much higher than drivers are used to, the federal government was reportedly considering the release of crude from the strategic petroleum reserve, even though according to analysts such a release may not do much about prices.  At the time of writing Brent crude was trading at $84.68 per barrel and West Texas Intermediate was changing hands at $83.83 per barrel. Both were down on the opening of trade today.  By Irina Slav for Oilprice.com",-1,-0.6124,"['million', ' ', 'barrels', 'week', 'middle', 'prices', 'oil', 'build', 'gasoline', 'production', 'bpd']"
California Is Addicted To Oil From The Amazon,2021-12-06T14:00:00-06:00,"California is by far the most ambitious U.S. state when it comes to things like emission standards, EV sales, and renewable energy. California is shutting down its nuclear power plants to double down on wind and solar.nbsp  It is also importing more oil from the Amazon rainforest than any country in the world.  Ecuador accounted for a little over 24 percent of Californiarsquos oil imports as of 2020. That equaled 55,219 barrels daily, according to the California Energy Commission. Interestingly, this is a substantial increase from the previous year, when Ecuador accounted for 18.22 percent of Californiarsquos oil imports, and from the year before, when Ecuador accounted for 14 percent.  This oil from Ecuador, according to a recent investigation by NBC News, comes from the Amazon rainforestmdashan area that is the target of massive conservation efforts and yet remains one of the most exploited parts of the world because of its natural resource wealth.  Ecuador is home to the Yasuni National Park, which contains some of the most diverse ecosystems globally, including two uncontacted indigenous tribes. For these tribes, the government even approved a so-called Intangible Zonemdasha border not to be crossed in order to protect these tribes. But that was before 2019. Two years ago, the government of Ecuador approved a plan to open up Yasuni National Park to oil and gas drilling.    Ecuador is a frequent reference in oil news, but the South American country has proven crude reserves estimated at 8.3 billion barrels, which makes it the third-largest oil country in Latin America, after Venezuela and Brazil. Yet, it doesnrsquot produce anywhere close to what Brazil pumps and what Venezuela did before the U.S. sanctions. Its average for 2020 was 483,000 bpd, according to the Energy Information Administration. But this is changing.  The president of the tiny South American nation, who took office this May, pledged to double the countryrsquos oil production and is working on this through some major reforms aimed at facilitating the participation of private companies in Ecuadorrsquos oil industry. According to Argus Media, the rush aims to monetize the countryrsquos oil assets before the energy transition kills demand for the fossil fuel. Yet judging from Californiarsquos appetite for Ecuadorian oil, this killing might take a while.  According to the NBC investigation, which was based on a report by Stand.earth and Amazon Watch, 66 percent of the oil produced in Ecuador is exported to the United States, and most of that ends up in California. As the two environmentalist groups put it, 1 in 7 tanks of gasoline, diesel, or jet fuel sold in California came from the Amazon rainforest. And thatrsquos not all.  Some of the biggest corporate users of Amazon oil in California are PepsiCo, Costco, and Amazon. All three have made emission-related pledges, with PepsiCo vowing to reduce absolute greenhouse gas emissions by 40 percent from 2015 levels by 2030 and net-zero status by 2040 and Amazon promising billions in investment to become a net-zero emitter by the same year.  ldquoThis is no longer one of those things where wersquore supposed to have sympathy for a crisis thatrsquos happening somewhere else,rdquo Angeline Robertson, a senior researcher at Stand.earth and the lead author of the report, told NBC. ldquoItrsquos occurring in California, and itrsquos linked to Amazon destruction.rdquo  It is also the latest proof that moving away from oil and gas is a lot easier said than done. For all of its anti-oil rhetoric, California is a major importer of the commodity. Before Ecuador became its top source of the commodity, it was importing most of its oil from Saudi Arabia and Iraq and smaller amounts from Colombia, Mexico, Nigeria, and Angola. California, therefore, is very much like any other oil importer in the world with one difference while other importers simply do not have the domestic production to use, California is purposefully squeezing its oil industry.  There are plans in place to ban fracking by 2024, with Governor Newsom saying in May that ldquoAs we move to swiftly decarbonize our transportation sector and create a healthier future for our children, Irsquove made it clear I donrsquot see a role for fracking in that future and, similarly, believe that California needs to move beyond oil.rdquo  This move would necessitate weaning the state off the more than 200,000 bpd of foreign oil it imports on top of more than 460,000 bpd in local production. Itrsquos going to be difficult. There is also a proposal to ban offshore drilling after an oil spill in October added fuel to arguments about whether oil had a future in California or not.  In Ecuador and in the Yasuni National Park, oil definitely has a future, unlike an attempt by a previous government to save its unique ecosystems by calling on the international community to provide $3.5 billion for conservation efforts. NBC recalls the government of Rafael Correa abandoned its plan to protect its share of the Amazon six years with international donations after it only managed to raise a tenth of what was needed. And then it lifted the drilling moratorium for Yasuni, with President Correa saying, ldquoThe world has failed us.rdquo  By Irina Slav for Oilprice.com",1,0.9459,"['oil', ' ', 'California', 'Ecuador', 'Amazon', 'percent', 'world', 'NBC', 'Yasuni', 'government', 'future']"
BP Oil & Gas Will Be Needed For Decades,2021-11-15T15:00:00-06:00,"Oil and gas will have a role to play in the energy system for decades to come, BPrsquos chief executive Bernard Looney said on Monday, adding that the industry should try to produce hydrocarbons with the lowest emissions possible.  Any scenario, even the International Energy Agencyrsquos Net-Zero by 2050 scenario, predicts that there will still be demand for oil in 2050, Looney told CNBC on the sidelines of the ADIPEC energy conference in Abu Dhabi.  According to the IEArsquos Net-Zero by 2050 scenario, in a world on track to achieve net-zero emissions within three decades, global oil demand would drop by 75 percent to 24 million barrels per day bpd, from around 90 million bpd in the pandemic year 2020 and around 100 million bpd in the pre-pandemic 2019.  ldquoSo any objective person that looks at this from an objective standpoint is going to say hydrocarbons have a role to play,rdquo Looney told CNBC.  As the world will not be moving away entirely from oil and gas, the question becomes ldquowhat do you do about thatrdquo, BPrsquos top executive noted.  ldquoWhat you do about that is try to produce those hydrocarbons in the best way possible,rdquo Looney said.nbsp  ldquoIt may not be popular to say that oil and gas is going to be in the energy system for decades to come but that is the reality,rdquo he told CNBC.  BP, like most European majors, is now pitching itself as an integrated energy company looking to transform into a broader energy firm from an international oil major.  BP has said it would cut its oil and gas productionnbspby 40 percentnbspby 2030 through active portfolio management and no exploration in new countries. Shell said earlier this year that its oil productionnbsppeaked in 2019, while Italyrsquos Eni sees its oil production peaking in 2025.  By Tsvetana Paraskova for Oilprice.com",1,0.91,"[' ', 'oil', 'energy', 'gas', 'Looney', 'decades', 'said', 'hydrocarbons', 'scenario', '2050', 'told']"
The U.S. Shale Patch Is Back In Growth Mode,2021-11-15T18:00:00-06:00,"U.S. shale production is back to growth mode as producers continue to add rigs onshore. Output will continue to climb over the next year as some large oil firms plan to raise spending in the Permian, which has been and will be the key driver of Americarsquos tight oil production growth.nbsp  Still, the rise in shale output will be slower than in the boom years of 2018 and 2019, as most operators continue to stick to capital discipline, while surging costs and labor shortages are major headwinds to significant production growth.nbspnbspnbsp  Next month, total U.S. shale production from the major tight oil plays is set to return to March 2020 levels, which was before companies slashed drilling activity in response to the plunge in prices and demand with the start of the pandemic. Shale output is set to rise 8.68 million barrels per day bpd in December, driven by an increase in Permian production, according to estimates from Rystad Energy quoted by Bloomberg. In November, Permian shale production is projected to hit 5.043 million bpd.  All projections expect U.S. shale production to grow in the coming months and lead to a 600,000 bpd-800,000 bpd increase in total American crude oil production in 2022 compared to 2021.nbspnbsp  Capital discipline is still key for the shale patch, but some majors signaled in the Q3 earnings calls that they could add more rigs in their Permian operations.nbsp  ExxonMobil, for example, said its Permian production in Q3 averaged around 500,000 oil-equivalent barrels per day, up by 30 percent from the third quarter of 2020.nbspnbsp  ldquoWe may see a couple of more rigs come on here as we go forwardrdquo with a focus on efficiencies, Exxonrsquos CEO Darren Woods said.nbsp  Chevron, for its part, will add two more rigs and completion crews in the Permian this quarter, CFO Pierre Breber said on the earnings call.nbsp  BPrsquos U.S. shale unit BPX plans to raise capital spending in the Permian to $1.5 billion in 2022 from $1 billion this year, BPrsquos chief financial officer Murray Auchincloss said on the companyrsquos call.nbsp  Related Oil Prices Under Pressure As Bearish Factors MountConocoPhillips will also boost activity in the Permian, but as with the majors, it will be a measured approach to raising drilling operations.nbsp  ldquoI wouldnrsquot call it a ramp. I would call it slow steady growth because I think that will build the most efficiency in our operations,rdquo Tim Leach, Executive Vice President, Lower 48, said earlier this month, referring to ConocoPhillipsrsquos plans for Permian growth.nbspnbsp  Yet, other shale operators signal more discipline and unwillingness to increase production. Diamondback Energy, for example, has said it will not increase its crude oil production next year despite the surge in prices.  Annual U.S. crude oil production will average 11.1 million bpd in 2021, increasing to 11.9 million bpd in 2022, largely as a result of onshore operators increasing rig counts, which will offset production decline rates, the EIA said in this monthrsquos Short-Term Energy Outlook STEO.nbsp  In its Monthly Oil Market Report MOMR released last week, OPEC forecast U.S. shale production to grow by 610,000 bpd annually - an average of 7.85 million bpd in 2022.nbsp  ldquoWith the current pace of drilling and well completion in oil fields, production of crude oil is forecast to grow by 0.6 mb/d y-o-y, to average 11.66 mb/d, and to exit 2022 at 12.1 mb/d. This forecast assumes ongoing capital discipline, limited active drilling rigs, completion crews and labour shortages,rdquo said the cartel about overall American crude oil production.    But the oil industry in Texas sees cost inflation and skilled labor supply as the main headwinds to production growth going forward.nbsp  Costs rose sharply for a second quarter in a row, the Q3 Dallas Fed Energy Survey showed at the end of September.nbsp  ldquoThe greatest headwind is skilled labor supply and access to expanding credit on our reserve base loan,rdquo an EampP firm executive wrote in comments in the survey. An executive at an oil and gas support service firm noted that ldquoLabor continues to be a struggle, and wages are at an all-time high because of inflation and printing too much money with all of the free giveaways. We are all going to have to pay for this sooner or later.rdquonbsp  Overall, U.S. shale is returning to growth after the COVID crisis, but the pace of this growth would be much slower than pre-pandemic rates due to capital discipline, labor shortages, and surging costs.nbsp  By Tsvetana Paraskova for Oilprice.com",-1,0.98,"[' ', 'production', 'oil', 'shale', 'Permian', 'U.S.', 'bpd', 'said', 'growth', 'rigs', 'discipline']"
Natural Gas Prices Could Spike As Europe Braces For Its First Cold Blast,2021-11-15T13:00:00-06:00,"After months of rollercoaster moves in European nat gas prices as energy producers and traders jockeyed for position ahead of what could be a brutal winter, all bets are now off as Europe is set to get its first cold blast of the winter season, putting the continentrsquos already scant energy supplies under pressure.  According tonbspBloomberg, temperatures are set to slide starting next week, with parts of Italy forecast to experience weather as much as 2 degrees Celsius below normal. Southern France, Spain and Germany are also forecast to be colder-than-usual, according to The Weather Company. Centrica, the U.K.rsquos top energy supplier,nbspwarned its 9 million customers to prepare for an icy blast that could last as long as six weeks.  Europe, whose nat gas inventories in storage are near record lows for this time of the year due to the continent's catastrophic fossil fuel policies and scramble to promote green energy at all costs even though it is nowhere near read to take the reins from legacy energy, will be particularly sensitive to cold snaps in the coming months, with gas prices up for a second week after surging to records in October. Extra supplies promised by Russia have so far been negligible and Norwegian flows have been reduced because of heavy maintenance.    ldquoThis is going to test the energy supplies across Europe,rdquo said Tyler Roys, lead European forecaster at AccuWeather Inc.  A high pressure system could also bring more northerly and colder air flows over central and southern Europe by the end of the month, said Carlo Cafaro, a senior research analyst and meteorologist at Marex.  While European gas prices have dropped from record highs, they are still almost four times higher than normal for this time of year sending electricity and European emission permits surging. Dutch month-ahead gas futures, the benchmark for Europe, rose 1.4% this week after climbing 14% last week.    According to AccuWeather's Roys, the cooler temperatures in the south will coincide with stormy weather over the Mediterranean with threats of flooding and mudslides. This will bring big swings in wind generation, likely to drive price volatility even higher.nbsp    While there is still hope that November temperatures on the whole could end up being close to normal, they will likely be cooler than the above-average levels for the past four years, according to Accuweather data must be that pesky global warming which the world's billionaires are so eager to spend our money to fight. That could also impact gas storage levels as companies withdraw supplies to meet higher demand, already roaring back as economies recover from the pandemic.    Meanwhile, the number of heating degree days, a measure of demand, will be higher than the 10-year normal during the next two weeks, according to Maxar. But there is still some uncertainty between models for northwest Europe, and forecasts havenrsquot been very accurate lately, said Steven Silver, a meteorologist at Maxar.  The arrival of cold weather in Europe would follow freezing temperatures and snow in China, the worldrsquos biggest energy consumer. Higher heating demand could intensify the already fierce battle for liquefied natural gas cargoes, with prices for flexible U.S. LNG still more attractive in Asia.  The development of the La Nina weather pattern in the Pacific basin means possible colder-than-average temperatures in Northeast Asia during the winter months, but better availability at nuclear reactors in Japan and South Korea, as well as higher domestic output in China, could keep any increases in LNG imports in check, Energy Aspects Ltd. said last week.  Meanwhile, perhaps not having received the latest weather update, in a note published late on Sunday, Goldman writes that while November weather in NW Europe looks close to the 10yr average, Goldman maintains its view thatnbspTTF needs to rally further from current levels to balance supply availability and demand destruction.nbspSpecifically, despite the recent sequential increase in Russian supply, we believe that the scale of the remaining shortfall of Russian flows warrants a $5 upside to TTF from $25/mmBtu currently to $30/mmBtu and JKM to $32/mmBtu to further curtail demand and help manage storage levels in Europe.  The main risk to this view, Goldman's Samantha Dart warns, would be a significant departure of Gazprom's Yamal bookings for Dec21 vs our 45 mcm/d expectation, which comes out Nov 15th. Specifically, a booking closer to the 75 mcm/d seasonal norm would likely bring forward our 1Q22 $17.60/mmBtu TTF price forecast, as lower demand destruction would be required to balance the market.  Of course, should winter weather turn out to be far colder than expected, then all bets are off.  By Zerohedge.com",-1,0.8229,"[' ', 'Europe', 'gas', 'energy', 'weather', 'demand', 'temperatures', 'week', '$', 'European', 'prices']"
Russia And Saudi Arabia See Oil Oversupply In 2022,2021-11-15T12:00:00-06:00,"ldquoEverybody is predicting a surplus of supply starting from the first or second quarter,rdquo next year, Russian Deputy Energy Minister Pavel Sorokin told Bloomberg on the sidelines of this weekrsquos oil industry even in Abu Dhabi.  The only question is when exactly that surplus will take placemdashbut the difference is only a few months, according to Sorokin.  ldquoInventories have stopped drawing, which shows there is no deficit at the moment,rdquo Sorokin added.  Russia took the opportunity to point fingers at the U.S. government, which has for weeks been accusing OPEC of refusing to increase production to ease gasoline prices at American fuel pumps.  According to Sorokin, the U.S. Federal Reserversquos policy has a much greater impact on the oil and gas market than the supply and demand situation.  This is an important distinction because BPrsquos CEO Bernard Looney, for example, also at Adipec, said that he expects oil prices to ldquoremain robust for some time to come.rdquo    The general consensus among those who ventured to comment on OPECrsquos future plans is that OPEC will stick to its production plans by agreeing at the next OPEC meeting to add another 400,000 bpd to the grouprsquos production quotas.  According to Saudi Arabiarsquos Energy Minister Prince Abdulaziz bin Salman, inventories could already begin to rise next month and into Q1 2020, adding that this 400,000 bpd would be ldquoenoughrdquo.  ldquoWe need not to panic,rdquo bin Salman said, ldquowe need to be calm.rdquo  Adipec, the rare in-person oil and gas industry event, also was a platform for discussions about the COP26 outcome. OPEC Secretary-General Mohammad Barkindo expressed his disappointment with the COP26 talks. This is the first COP talks that targeted the oil and gas industry yet didnrsquot involve the industry in conversations about how to slow climate change.  ldquoFor us attending in Glasgow, this was an alarm bell, Barkindo said. ldquoI left Glasgow with this sobering feeling.rdquo By Julianne Geiger for Oilprice.com",-1,0.7689,"[' ', 'oil', 'Sorokin', 'industry', 'OPEC', 'rdquo', 'production', 'gas', 'said', 'surplus', 'supply']"
Yergin Underinvestment May Lead To Series of Energy Crunches,2021-11-15T11:00:00-06:00,"The oil industry is not investing enough to meet growing energy demand, including for crude, which could lead to a series of energy crunches down the road, oil expert Daniel Yergin, vice chairman of IHS Markit, told CNBC on Monday.  ldquoI think we should be conscious that one of the things we may see is a series of crunches,rdquo Yergin told CNBC, referring to what he dubbed a ldquopre-emptive underinvestmentrdquo in oil supply while global demand continues to rise.  ldquoWorld demand is going to be back where it was in 2019 in the next few months,rdquo the expert said, adding that there is a ldquodisconnect between the realities of the dynamics of the marketrdquo and the calls from investors for the oil industry to stick to capital discipline.  Yergin is the latest industry expert warning of future energy crunches as the world is not investing enough in meeting the still growing demand for oil and gas.  Industry executives have been warning this year of the underinvestment in traditional energy supply.  The oil industry isnbspldquomassively underinvestingrdquonbspin supply to meet growing demand, which is set to return to pre-COVID levels as soon as the end of 2021 or early 2022, Greg Hill, president of U.S. oil producer Hess Corp, said at the end of September.  The rebound in global demand for oil and gas and the gap between supply and demand could lead to a new supercycle for oil and gas, Rosneftrsquos chief executive Igor Sechin said on Friday.  At the end of last month, Saudi Aramcorsquos chief executive Amin Nasser said that crude oil production capacity was dwindling globally, and more investments in new productionnbspare needed urgently.  Last week, Nasser said that the world would see its level of spare oil production capacitynbspdwindle next yearnbspas jet fuel demand returns to pre- or near-pre-crisis levels.  By Tsvetana Paraskova for Oilprice.com",-1,-0.765,"['oil', ' ', 'demand', 'said', 'industry', 'energy', 'supply', 'growing', 'crunches', 'expert', 'Yergin']"
